"conversation_id_str","created_at","favorite_count","full_text","id_str","image_url","in_reply_to_screen_name","lang","location","quote_count","reply_count","retweet_count","tweet_url","user_id_str","username"
"1961237142195376510","Fri Aug 29 01:19:07 +0000 2025","0","Sosialisasi literasi digital terhadap masyarakat di wilayah hukum polres Rokan hilir https://t.co/gyShiSzJIY","1961237142195376510","https://pbs.twimg.com/media/Gze2yXhbkAEbCcl.jpg","","in","","0","0","0","https://x.com/undefined/status/1961237142195376510","2783403607",
"1961225578557673683","Fri Aug 29 00:33:10 +0000 2025","0","Panduan mendidik anak di era digital dengan aturan gadget literasi digital dan teknologi edukasi agar anak cerdas aman dan kreatif. https://t.co/8r73tj9EuW","1961225578557673683","","","in","","0","0","0","https://x.com/undefined/status/1961225578557673683","1404018642",
"1961164675997208621","Thu Aug 28 20:31:10 +0000 2025","0","ayo lawan propaganda negatif dgn meningkatkan literasi digital masyarakat https://t.co/8IINagJtXg","1961164675997208621","https://pbs.twimg.com/media/Gzd036paQAAwWJm.jpg","","in","","0","0","0","https://x.com/undefined/status/1961164675997208621","2426707537",
"1961157779592466497","Thu Aug 28 20:03:45 +0000 2025","0","penting banget literasi digital biar kita paham dan ga gampang terpengaruh info menyesatkan https://t.co/WXI6G21XTz","1961157779592466497","https://pbs.twimg.com/media/GzdumiYaYAAlcv9.jpg","","in","","0","0","0","https://x.com/undefined/status/1961157779592466497","2373250838",
"1961128611282563267","Thu Aug 28 18:07:51 +0000 2025","1","Pengelola JDIH Kanwil Kemenkum Sumbar ikut Bimtek Nasional Tingkatkan standar pengolahan &amp; layanan literasi hukum digital. https://t.co/nGqthDIzyA #KementerianHukum #LayananHukumMakinMudah #KanwilKemenkumSumbar https://t.co/CtqgoRE3sn","1961128611282563267","https://pbs.twimg.com/media/GzdUDo6bkAYV088.jpg","","in","","0","0","0","https://x.com/undefined/status/1961128611282563267","836162285722710017",
"1961123715053228067","Thu Aug 28 18:05:42 +0000 2025","0","@Idksthhere @408NotFoun Tolol sekali data pribadi masih bertebaran literasi digital masih jelek mental masih apa-apa lari napak tanah dan percaya dia sespesial itu. Mahluk laknat bangsat perlu di-drill down ajarannya biar ga tolol lagi.","1961128070003528158","","Idksthhere","in","","0","0","0","https://x.com/undefined/status/1961128070003528158","1600176671646048259",
"1960941799645564982","Thu Aug 28 16:49:09 +0000 2025","0","@goodnewsfromIDN Dengan literasi digital yang kuat kita nggak mudah tertipu hoaks Kayak video transfer Rp40 juta Prabowo yang cuma editan #ruangdigitalaman","1961108807297503501","","goodnewsfromIDN","in","","0","0","0","https://x.com/undefined/status/1961108807297503501","1698906253953802240",
"1961105428823015610","Thu Aug 28 16:35:44 +0000 2025","0","[ICYMI] Seberapa baik kemampuan warganet Indonesia mencermati sumber informasi yang kredibel? Hasil analisis PISA ini mungkin bisa menjawab. https://t.co/1SPboKGJrG","1961105428823015610","","","in","","0","0","0","https://x.com/undefined/status/1961105428823015610","146060482",
"1960941799645564982","Thu Aug 28 16:04:09 +0000 2025","0","@goodnewsfromIDN Literasi digital bisa cegah termakan hoaks buktinya video Prabowo transfer Rp40 juta cuma rekayasa saling edukasi di #ruangdigitalaman","1961097478692094115","","goodnewsfromIDN","in","","0","0","0","https://x.com/undefined/status/1961097478692094115","1702588250416967680",
"1960941799645564982","Thu Aug 28 15:42:02 +0000 2025","0","@goodnewsfromIDN Video viral Prabowo transfer Rp40 juta itu deepfake literasi digital jadi kunci menangkal hoaks di #ruangdigitalaman","1961091915438551141","","goodnewsfromIDN","in","","0","0","0","https://x.com/undefined/status/1961091915438551141","1695004507439329281",
"1960941799645564982","Thu Aug 28 15:39:51 +0000 2025","0","@goodnewsfromIDN Video Prabowo transfer Rp40 juta adalah contoh hoaks digital mari kuatkan literasi untuk Indonesia lebih bersatu di #ruangdigitalaman","1961091364390891938","","goodnewsfromIDN","in","","0","0","0","https://x.com/undefined/status/1961091364390891938","1702625561632493568",
"1882319421890539817","Thu Aug 28 15:25:23 +0000 2025","0","Kabid Humas Polda DIY Hadiri Seminar Nasional Literasi Digital #PoldaDIY #PoldaJogja #BidhumasPoldaDIY #KabidHumasPoldaDIY #LiterasiDigital https://t.co/zkWBRQXCCO","1961087726817558893","","PoldaJogja","in","","0","0","0","https://x.com/undefined/status/1961087726817558893","818341300797722624",
"1961084160153690117","Thu Aug 28 15:11:16 +0000 2025","0","Program ini mencakup literasi digital kewirausahaan personal branding dan HKI. Siswa juga akan menjalani talent mapping &amp; diharapkan mendapat sertifikasi profesi.","1961084172673462294","","txtdarillm","in","","0","1","0","https://x.com/undefined/status/1961084172673462294","1795100176639815680",
"1961065765857362190","Thu Aug 28 13:58:08 +0000 2025","1","list tugas yang belum : 1. reflection english (dl minggu siang) 2. buat refleksi mengenai penggunaan teknologi digital beserta contoh positif di kehidupan sehari hari dalam penenerapan literasi digital. spasi 1 5 maks 500 kata rata kiri kanan 3. tugas pph kelompok (dl minggu)","1961065765857362190","","","in","","1","0","0","https://x.com/undefined/status/1961065765857362190","1874068232375865344",
"1961061497762984042","Thu Aug 28 13:41:10 +0000 2025","0","Mari bareng-bareng perkuat literasi digital stop percaya video hoaks Prabowo transfer Rp40 juta #ruangdigitalaman https://t.co/qRVGnm4IYH","1961061497762984042","https://pbs.twimg.com/media/GzcXCCobEAA62vZ.jpg","","in","","0","0","0","https://x.com/undefined/status/1961061497762984042","1684837430980169728",
"1960941799645564982","Thu Aug 28 13:33:32 +0000 2025","0","@goodnewsfromIDN Video Prabowo transfer uang Rp40 juta itu hasil rekayasa digital bukan fakta. Literasi digital bikin kita lebih siap di #ruangdigitalaman","1961059576725360845","","goodnewsfromIDN","in","","0","0","0","https://x.com/undefined/status/1961059576725360845","1832649376269049856",
"1961058581433995591","Thu Aug 28 13:29:35 +0000 2025","1","Melek AI sudah menjadi life skill penting seperti halnya literasi tradisional. Bukan tentang menjadi programmer atau data scientist tetapi tentang menjadi warga digital yang cerdas https://t.co/zVbRjAdIWk","1961058581433995591","","","in","","0","0","0","https://x.com/undefined/status/1961058581433995591","146060482",
"1961035544416149856","Thu Aug 28 11:58:13 +0000 2025","0","Kegiatan ini diharapkan mendorong peningkatan literasi digital kolaborasi dan inovasi bagi UMKM serta pelaku usaha agar siap menghadapi era perdagangan digital. https://t.co/JPWTwygAQp","1961035590683820034","https://pbs.twimg.com/media/Gzb_coka0AAqcaW.jpg","KominfoJatim","in","","0","0","0","https://x.com/undefined/status/1961035590683820034","1569962529178402817",
"1961035544416149856","Thu Aug 28 11:58:02 +0000 2025","0","Dinas Kominfo Jatim bersama KADIN dan PRSSNI Jawa Timur menggelar kegiatan Sinergitas Peningkatan Literasi Bagi Masyarakat dengan tema Transformasi Digital dalam Perdagangan: Peluang dan Tantangan di Surabaya 28 Agustus 2025. https://t.co/CSOYLTqJG8","1961035544416149856","https://pbs.twimg.com/media/Gzb_agDbwAA0F2q.jpg","","in","","0","1","0","https://x.com/undefined/status/1961035544416149856","1569962529178402817",
"1960941799645564982","Thu Aug 28 10:50:11 +0000 2025","0","@goodnewsfromIDN Gencarkan literasi digital biar nggak mudah termakan hoaks kayak video Presiden Prabowo transfer Rp40 juta Ayo tetap jaga #ruangdigitalaman","1961018469681451157","","goodnewsfromIDN","in","","0","0","0","https://x.com/undefined/status/1961018469681451157","1700078093837479936",
"1961009533809209753","Thu Aug 28 10:14:45 +0000 2025","1"," Buka peluang kepada mereka yang ada masalah penglihatan minat belajar secara audio atau cabaran membaca; dan Bantu komuniti membina literasi digital dan keyakinan menggunakan kod QR serta platform dalam talian. #BersamaMalaysiaku","1961009549466550578","","fauzimdisa","in","","0","0","2","https://x.com/undefined/status/1961009549466550578","1654350660073295874",
"1876547504457892011","Thu Aug 28 10:04:30 +0000 2025","0","@yayaokedeh @sleepapneu @UGM_FESS Akan ada case tentang literasi digital pemanfaatan IT dll yang diselesein dalam kelompok. Kolaborasi antarjurusan tapi biasanya ada mahasiswa teknologi informasi yang dibagi merata di setiap kelompok. ","1961006972830187918","","yayaokedeh","in","","0","0","0","https://x.com/undefined/status/1961006972830187918","1265096263713697793",
"1961001093703647522","Thu Aug 28 09:41:09 +0000 2025","0","Pada pagi tadi 28 Ogos 2025 (Jumaat) Cawangan Transformasi Digital bersama Cawangan Sumber Manusia Ibu Pejabat JBALB Sarawak telah menganjurkan satu mesyuarat berkenaan Program Literasi Digital 2025 Penjawat Awam Sarawak bertempat di The Waterfront Hotel Kuching. https://t.co/emd3jT1uPK","1961001093703647522","https://pbs.twimg.com/media/GzbgD0wawAAHwCa.jpg","","in","","0","0","0","https://x.com/undefined/status/1961001093703647522","760142917218422784",
"1960990489345466805","Thu Aug 28 08:59:00 +0000 2025","4","Gubernur Lemhanas Ace Hasan Ingatkan Ancaman Disinformasi dan Pentingnya Literasi Digital #bahlillahadalia #kuningkeren #golkarindonesia #partaigolkar #golkarpedia https://t.co/s9Kvk18oCh","1960990489345466805","","","in","","0","0","26","https://x.com/undefined/status/1960990489345466805","721898354502930433",
"1960988869387530319","Thu Aug 28 08:52:36 +0000 2025","2","Dengan pelbagai inisiatif melibatkan literasi digital perlindungan pengguna dan keselamatan data MCCA menjadi peneraju dalam usaha melahirkan masyarakat yang celik teknologi serta berdaya tahan terhadap ancaman siber. ️","1960988878300409996","","bahterasiber","in","","0","1","0","https://x.com/undefined/status/1960988878300409996","1443481414008074242",
"1960987137790369960","Thu Aug 28 08:45:41 +0000 2025","0","Deepfake makin marak kayak video Prabowo transfer Rp40 juta ini. Literasi digital jawaban biar kita nggak gampang terhasut #ruangdigitalaman https://t.co/irBoscPyPF","1960987137790369960","https://pbs.twimg.com/media/GzbTZy-aEAAKLwv.jpg","","in","","0","0","0","https://x.com/undefined/status/1960987137790369960","1702603418635038720",
"1960985969445745075","Thu Aug 28 08:41:03 +0000 2025","0","Video transfer Rp40 juta oleh Prabowo hanyalah deepfake mari cerdas menerapkan literasi digital dalam #ruangdigitalaman https://t.co/zOX9znCZnK","1960985969445745075","https://pbs.twimg.com/media/GzbSVeXa4AIFMt9.jpg","","in","","0","0","0","https://x.com/undefined/status/1960985969445745075","1696002606357987328",
"1960977899088961570","Thu Aug 28 08:08:59 +0000 2025","0","Kepala Diskominfo Kabupaten Lumajang Mustaqim menegaskan bahwa literasi digital adalah bentuk edukasi yang sangat penting bagi masyarakat agar dapat memanfaatkan ruang siber secara cerdas aman dan produktif. Minggu (24/8/2025) selengkapnya: https://t.co/FMV6bClFBF https://t.co/OeTzU17L4A","1960977899088961570","https://pbs.twimg.com/media/GzbK_7iawAAl5CS.jpg","","in","","0","0","0","https://x.com/undefined/status/1960977899088961570","957856187839475713",
"1960976995657113758","Thu Aug 28 08:05:23 +0000 2025","0","Video deepfake transfer uang Prabowo itu nggak benar adanya. Tingkatkan literasi digital dan sebarin hal positif #ruangdigitalaman https://t.co/nYMItXSrpx","1960976995657113758","https://pbs.twimg.com/media/GzbKJOsW0AAkBvi.jpg","","in","","0","0","0","https://x.com/undefined/status/1960976995657113758","1702609903842729984",
"1960968375523532895","Thu Aug 28 07:31:08 +0000 2025","0","Kabar tentang Prabowo transfer Rp40 juta lewat video itu ternyata hasil digital fake. Jaga selalu literasi biar nggak mudah dibohongi #ruangdigitalaman https://t.co/qfpJp5vLbF","1960968375523532895","https://pbs.twimg.com/media/GzbCUyia4AIdB_x.jpg","","in","","0","0","0","https://x.com/undefined/status/1960968375523532895","1686997513822466048",
"1960968238768050402","Thu Aug 28 07:30:35 +0000 2025","0","Program Sosialisasi Mahasiswa KKN UNISRI Surakarta; Meningkatkan Literasi Digital di Desa Kebonalas: Edukasi Media Sosial untuk Gen Z dan Orang Tua https://t.co/jD6pb2xTbU","1960968238768050402","","","in","","0","0","0","https://x.com/undefined/status/1960968238768050402","1739305684452405248",
"1960967481054380381","Thu Aug 28 07:27:35 +0000 2025","0","Jangan asal percaya trend viral video transfer Rp40 juta oleh Presiden Prabowo itu editan digital literasi digital jadi pelindung #ruangdigitalaman https://t.co/WfxzQRiVxE","1960967481054380381","https://pbs.twimg.com/media/GzbBhpua4AIc54D.jpg","","in","","0","0","0","https://x.com/undefined/status/1960967481054380381","1694933987570135041",
"1960967211654504533","Thu Aug 28 07:26:30 +0000 2025","0","Waspadai konten deepfake video Presiden Prabowo transfer Rp40 juta bukan asli literasi digital penting supaya #ruangdigitalaman makin terjaga https://t.co/wkX3IXcjaA","1960967211654504533","https://pbs.twimg.com/media/GzbBSBOa4AUk3d0.jpg","","in","","0","0","0","https://x.com/undefined/status/1960967211654504533","1843493229997772800",
"1960966198126092562","Thu Aug 28 07:22:29 +0000 2025","0","Literasi digital itu penting apalagi soal hoaks video Prabowo transfer Rp40 juta yang cuma hasil deepfake. Jaga sosial media kita #ruangdigitalaman https://t.co/9APPymqL7P","1960966198126092562","https://pbs.twimg.com/media/GzbAXCUaMAAn8Bf.jpg","","in","","0","0","0","https://x.com/undefined/status/1960966198126092562","1702553338204815360",
"1960964049119928818","Thu Aug 28 07:13:56 +0000 2025","0","Mari bareng-bareng perkuat literasi digital stop percaya video hoaks Prabowo transfer Rp40 juta #ruangdigitalaman https://t.co/VPPBpDTT58","1960964049119928818","https://pbs.twimg.com/media/Gza-Zyka4AE4flu.jpg","","in","","0","0","0","https://x.com/undefined/status/1960964049119928818","1684837430980169728",
"1960962431645311219","Thu Aug 28 07:07:31 +0000 2025","0","Selalu kritis sama informasi video transfer Rp40 juta dari Presiden Prabowo itu palsu kita jaga #ruangdigitalaman dengan literasi digital yang kuat https://t.co/x3MCE6Mno2","1960962431645311219","https://pbs.twimg.com/media/Gza87yDa4AQMCic.jpg","","in","","0","0","0","https://x.com/undefined/status/1960962431645311219","1696015307369013248",
"1960962293329490094","Thu Aug 28 07:06:58 +0000 2025","0","Hoaks video Presiden Prabowo dan transfer Rp40 juta berbahaya untuk persatuan digital. Literasi digital kunci buat #ruangdigitalaman yang sejuk https://t.co/aTRmvOxncv","1960962293329490094","https://pbs.twimg.com/media/Gza8vHEa4AE3ipg.jpg","","in","","0","0","0","https://x.com/undefined/status/1960962293329490094","1696016342892380160",
"1960961388391882828","Thu Aug 28 07:03:22 +0000 2025","0","Hoaks video Presiden Prabowo transfer Rp40 juta muncul karena rekayasa digital. Ayo tingkatkan kewaspadaan dan literasi di #ruangdigitalaman https://t.co/VKnZue18fj","1960961388391882828","https://pbs.twimg.com/media/Gza7_BKbsAAKAEB.jpg","","in","","0","0","0","https://x.com/undefined/status/1960961388391882828","1702174544109461504",
"1960960600726458580","Thu Aug 28 07:00:14 +0000 2025","0","Perwira PT PAG Ikut Pertamina Energi Negeri 8.0 di Lhokseumawe Dukung Literasi dan Pendidikan Digital Baca Selengkapnya: https://t.co/dmKTrDYY7i","1960960600726458580","","","in","","0","0","0","https://x.com/undefined/status/1960960600726458580","3733091832",
"1960954924189278564","Thu Aug 28 06:37:41 +0000 2025","0","Jangan mau dibohongi digital video Prabowo transfer Rp40 juta itu palsu literasi digital kuncinya #ruangdigitalaman https://t.co/xKWb9iDw5p","1960954924189278564","https://pbs.twimg.com/media/Gza2GqQa4AIC0Cs.jpg","","in","","0","0","0","https://x.com/undefined/status/1960954924189278564","1702621520194093056",
"1960954687534064085","Thu Aug 28 06:36:44 +0000 2025","0","Tingkatkan literasi digital jangan percaya video deepfake Prabowo transfer Rp40 juta itu murni rekayasa #ruangdigitalaman https://t.co/SApThQAGdK","1960954687534064085","https://pbs.twimg.com/media/Gza14-LaMAAS0aW.jpg","","in","","0","0","0","https://x.com/undefined/status/1960954687534064085","1696027018641756160",
"1960953499195466093","Thu Aug 28 06:32:01 +0000 2025","0","Digital literasi bisa cegah hoaks kayak video Prabowo transfer Rp40 juta yuk lebih selektif info biar #ruangdigitalaman tercipta https://t.co/jHqGBFFAtt","1960953499195466093","https://pbs.twimg.com/media/Gza0zuTa4AAcMHT.jpg","","in","","0","0","0","https://x.com/undefined/status/1960953499195466093","1702610934781685760",
"1960944851068842125","Thu Aug 28 05:57:39 +0000 2025","0","Literasi siber penting tapi kalau gak ada payung hukum serangan digital bakal tetap mengancam. Saatnya dukung aturan tegas! @prabowo @DPR_RI @kemkomdigi @BSSN_RI #undangundang #daruratkeamanansiber https://t.co/lHuI09NYEj","1960944851068842125","","","in","","0","0","0","https://x.com/undefined/status/1960944851068842125","1908731114153275392",
"1960926406634082810","Thu Aug 28 04:44:22 +0000 2025","10","Era digital ancaman keamanan dan persatuan gak hanya dari senjata ato pasukan tp bisa lahir dari akun2 provokator satu narasi &amp; unggahan viral Perlu paham literasi digital verifikasi informasi kewaspadaan publik tameng utama menghadapi provokasi Bersatu lawan provokasi ! https://t.co/RdM1aNEdOF","1960926406634082810","https://pbs.twimg.com/ext_tw_video_thumb/1960924144318681088/pu/img/XfycFESMO6QCr1Jt.jpg","","in","","0","1","0","https://x.com/undefined/status/1960926406634082810","1526738394386075648",
"1960919610695540803","Thu Aug 28 04:17:27 +0000 2025","0","Kanwil Kemenkum DIY terus beradaptasi dengan era digital. Edukasi SPBE menjadi momen penting untuk meningkatkan literasi keamanan siber di lingkungan kerja. #kanwilkemenkumjogja #kanwilkemenkumdiy #kanwilkemenkumyogyakarta #KementerianHukum #LayananHukumMakinMudah","1960919635152527469","","kemenkumjogja","in","","0","1","0","https://x.com/undefined/status/1960919635152527469","1597766452161187840",
"1960919610695540803","Thu Aug 28 04:17:24 +0000 2025","0","Edukasi SPBE Kanwil Kemenkum DIY sebagai upaya meningkatkan literasi keamanan digital. Langkah ini penting untuk melindungi data dan layanan publik dari potensi serangan. #kanwilkemenkumjogja #kanwilkemenkumdiy #kanwilkemenkumyogyakarta #KementerianHukum #LayananHukumMakinMudah","1960919621076390053","","kemenkumjogja","in","","0","1","0","https://x.com/undefined/status/1960919621076390053","1597766452161187840",
"1960899649931501956","Thu Aug 28 02:58:02 +0000 2025","0","#SobatTIKnas Survei BBC Media Action 2024 menunjukkan literasi digital anak muda Indonesia lebih tinggi dibanding kelompok usia tua tanpa perbedaan signifikan antara laki-laki &amp; perempuan. #literasi #literasidigital #transformasidigital #wantiknas https://t.co/ktJ4tshvU3","1960899649931501956","https://pbs.twimg.com/media/GzaD04wa4AAvIoi.jpg","","in","","0","0","0","https://x.com/undefined/status/1960899649931501956","168341182",
"1960884855283311067","Thu Aug 28 01:59:15 +0000 2025","0","generasi muda bukan cuma korban narasi tapi juga bisa jadi agen perubahan sebarkan konten damai dan literasi digital yang cerdas https://t.co/PfDZ5GXj4H","1960884855283311067","","","in","","0","0","0","https://x.com/undefined/status/1960884855283311067","1942481027022381057",
"1960883930724475101","Thu Aug 28 01:55:35 +0000 2025","0","mumpung masih ada kesempatan yuk rawat keindonesiaan kita dengan dialog kritik sehat dan literasi bareng demi masa depan digital yang inklusif https://t.co/0Pn4IcdlT4","1960883930724475101","","","in","","0","0","0","https://x.com/undefined/status/1960883930724475101","1908660168579002368",
"1960883902954004532","Thu Aug 28 01:55:28 +0000 2025","0","internet boleh cepat tapi kalau tanpa literasi digital kita gampang percaya palsu dan malah bantu nyebarin radikalisme https://t.co/mQY5P9xCht","1960883902954004532","","","in","","0","0","0","https://x.com/undefined/status/1960883902954004532","1908562908109234176",
"1960883677375946912","Thu Aug 28 01:54:34 +0000 2025","0","literasi kritis dan melek media itu senjata keren buat lawan hoaks dan ide cengeng digital https://t.co/e7xaGGzTPt","1960883677375946912","","","in","","0","0","0","https://x.com/undefined/status/1960883677375946912","1908600791209738241",
"1960870336876175717","Thu Aug 28 01:01:34 +0000 2025","1","Kepolisian Resor Kepulauan Tanimbar Bhabinkamtibmas Desa Ilngei barat sambangi warga binaan serta sosialisasikan Literasi Digital. #kapolreskepulauantanimbar #divisihumaspolri #polriuntukmasyarakat #poldamaluku https://t.co/HE8OduSjgY","1960870336876175717","https://pbs.twimg.com/media/GzZpLbaa4AQydo7.jpg","","in","","0","0","0","https://x.com/undefined/status/1960870336876175717","1461254089",
"1959950581730001256","Wed Aug 27 14:50:34 +0000 2025","0","@theunjae @unesa_fess aku ada literasi digital bisa dm ya","1960716573741576568","","theunjae","in","","0","0","0","https://x.com/undefined/status/1960716573741576568","1803081591738220544",
"1960704763181367448","Wed Aug 27 14:03:38 +0000 2025","0","Fenomena @Salsaer dari Denmark membuktikan bahwa provokasi digital lintas negara bisa memicu eskalasi sosial. Inilah urgensi literasi digital di Indonesia. https://t.co/Qf2cwRU3aZ","1960704763181367448","https://pbs.twimg.com/media/GzXSlQHa4AUhq6L.jpg","","in","","0","0","0","https://x.com/undefined/status/1960704763181367448","1917942645969829889",
"1960702861605789861","Wed Aug 27 13:56:08 +0000 2025","0","Pemerintah dan sekolah perlu mengembangkan dialog terbuka forum aspirasi serta edukasi literasi digital kritis. Ini penting agar pelajar dapat menyalurkan pandangan dan membedakan informasi alih-alih hanya dilarang.","1960702877770330347","","txtdarillm","in","","0","0","0","https://x.com/undefined/status/1960702877770330347","1795100176639815680",
"1960662557716570382","Wed Aug 27 11:15:57 +0000 2025","0","Upaya ini sebagai langkah pre-emptive &amp; preventive. Bareskrim juga rilis iklan layanan masyarakat dan literasi digital pencegahan.","1960662566625272140","","txtdarillm","in","","0","1","0","https://x.com/undefined/status/1960662566625272140","1795100176639815680",
"1960644493981503561","Wed Aug 27 10:04:09 +0000 2025","0","Ekosistem digital BRI dorong literasi &amp; akses keuangan. #KinerjaBRI #KonsistensiBRI #qrisbri https://t.co/ktHXx9Pq2l","1960644493981503561","https://pbs.twimg.com/media/GzWbxuwa4AAJYBt.jpg","","in","","0","0","0","https://x.com/undefined/status/1960644493981503561","1816376971670216705",
"1960644472548540794","Wed Aug 27 10:04:03 +0000 2025","0","Buku2 di SIBI trutama buku bacaannya ini cocok bgt dikenalin ke anak. selain ngenalin literasi pesan dr ceritanya slalu mantap. Bs bntu ngebentuk karaktek anak. Yok para ortu arahin anak gunain device positif contohnya bca buku digital ini. Cek SIBI dia ada dibagian nonteks ya","1960644472548540794","","","in","","0","0","0","https://x.com/undefined/status/1960644472548540794","3560273479",
"1960636297133121813","Wed Aug 27 09:31:40 +0000 2025","3","2 Apa kontribusi [prodi kamu] dalam kemajuan indonesia? jawab yang realistis sesuai pandangan kamu even better kalo pake data. contoh karena prodi-ku Sastra Inggris aku mention data terkait kemampuan bahasa inggris masyarakat Indonesia indeks literasi digital dsb nya","1960636319866212604","","alifyuhh","in","","0","1","1","https://x.com/undefined/status/1960636319866212604","1213787016099323905",
"1960636140341616757","Wed Aug 27 09:31:00 +0000 2025","0","Meskipun penangkapan ini penting maraknya judi online menunjukkan tantangan besar. Regulasi dan pengawasan finansial di Indonesia perlu lebih ketat. Kurangnya literasi digital serta kemudahan akses memicu banyak pihak terjebak dalam praktik ilegal ini.","1960636154656776192","","txtdarillm","in","","0","1","0","https://x.com/undefined/status/1960636154656776192","1795100176639815680",
"1960636100356997260","Wed Aug 27 09:30:47 +0000 2025","0","Yeay literasi digital meningkat bikin netizen makin cerdas. Kita Nyaman Karena Aman https://t.co/9Y4EjG8fZ5","1960636100356997260","","","in","","0","0","0","https://x.com/undefined/status/1960636100356997260","1942362806185349120",
"1960636086889123882","Wed Aug 27 09:30:44 +0000 2025","0","Yeay literasi digital jadi modal penting hadapi serangan siber. Kita Nyaman Karena Aman https://t.co/eYbvhhTpWN","1960636086889123882","","","in","","0","0","0","https://x.com/undefined/status/1960636086889123882","1941992784866795520",
"1960636073404461486","Wed Aug 27 09:30:41 +0000 2025","0","Yeay literasi digital bikin masyarakat lebih tangguh hadapi ancaman. Kita Nyaman Karena Aman https://t.co/Xn5oCEA8B4","1960636073404461486","","","in","","0","0","0","https://x.com/undefined/status/1960636073404461486","1941034969817812992",
"1960636007629390112","Wed Aug 27 09:30:25 +0000 2025","0","Yeay literasi digital bikin masyarakat lebih siap menghadapi siber. Kita Nyaman Karena Aman https://t.co/Ne2aW6BwJb","1960636007629390112","","","in","","0","0","0","https://x.com/undefined/status/1960636007629390112","1942046472176128000",
"1960635994174026103","Wed Aug 27 09:30:22 +0000 2025","0","Yeay ! Literasi digital bikin masyarakat cerdas hadapi siber. Kita Nyaman Karena Aman https://t.co/Cgx3LlOppL","1960635994174026103","","","in","","0","0","0","https://x.com/undefined/status/1960635994174026103","1941996143434735616",
"1960635735402254380","Wed Aug 27 09:29:20 +0000 2025","0","Yeay literasi digital bikin masyarakat lebih tangguh hadapi siber. Kita Nyaman Karena Aman https://t.co/edlB0zlTbW","1960635735402254380","","","in","","0","0","0","https://x.com/undefined/status/1960635735402254380","1923461193051635712",
