"conversation_id_str","created_at","favorite_count","full_text","id_str","image_url","in_reply_to_screen_name","lang","location","quote_count","reply_count","retweet_count","tweet_url","user_id_str","username"
"1960635446704140457","Wed Aug 27 09:28:11 +0000 2025","0","Wuihh literasi digital bikin semua generasi makin cerdas. Kita Nyaman Karena Aman https://t.co/YIacYg6n53","1960635446704140457","","","in","","0","0","0","https://x.com/undefined/status/1960635446704140457","1908868680131248128",
"1960635433143926982","Wed Aug 27 09:28:08 +0000 2025","0","Wuihh literasi digital bikin anak muda melek siber. Kita Nyaman Karena Aman https://t.co/zzWVr6UX7N","1960635433143926982","","","in","","0","0","0","https://x.com/undefined/status/1960635433143926982","1908600791209738241",
"1960635419680215280","Wed Aug 27 09:28:05 +0000 2025","0","Wuihh literasi digital bikin anak muda makin melek keamanan siber. Kita Nyaman Karena Aman https://t.co/7OXIghNOUj","1960635419680215280","","","in","","0","0","0","https://x.com/undefined/status/1960635419680215280","1714195958",
"1960635159411052988","Wed Aug 27 09:27:03 +0000 2025","0","Wahh literasi digital akan mendorong masyarakat jadi pengguna internet yang bijak. Kita Nyaman Karena Aman https://t.co/JyihcBEhbb","1960635159411052988","","","in","","0","0","0","https://x.com/undefined/status/1960635159411052988","1923630663867170816",
"1960634807949340998","Wed Aug 27 09:25:39 +0000 2025","0","Senangnya literasi digital bikin anak muda makin melek keamanan siber. Kita Nyaman Karena Aman https://t.co/X2N3hrvoDF","1960634807949340998","","","in","","0","0","0","https://x.com/undefined/status/1960634807949340998","1309728618",
"1960633082999972195","Wed Aug 27 09:18:48 +0000 2025","0","Asiikkk literasi digital bikin generasi muda siap hadapi ancaman. Kita Nyaman Karena Aman https://t.co/C68Q8guwHz","1960633082999972195","","","in","","0","0","0","https://x.com/undefined/status/1960633082999972195","1908488972528975873",
"1960632677511409922","Wed Aug 27 09:17:11 +0000 2025","0","Beuh literasi digital akan semakin meningkat dengan adanya perlindungan ini. Kita Nyaman Karena Aman https://t.co/2v01o5GIGe","1960632677511409922","","","in","","0","0","0","https://x.com/undefined/status/1960632677511409922","1617209436",
"1960632489262608514","Wed Aug 27 09:16:26 +0000 2025","0","Wah keren! Literasi digital dan kolaborasi lintas sektor digelorakan Kita Nyaman Karena Aman https://t.co/4uIPvQVYAF","1960632489262608514","","","in","","0","0","0","https://x.com/undefined/status/1960632489262608514","1908518469815189504",
"1960614490514579846","Wed Aug 27 08:04:55 +0000 2025","0","Kepala Diskominfo Kabupaten Lumajang Mustaqim menegaskan bahwa literasi digital adalah bentuk edukasi yang sangat penting bagi masyarakat agar dapat memanfaatkan ruang siber secara cerdas aman dan produktif. Minggu (24/8/2025) baca selengkapnya: https://t.co/h8nlbxISXy https://t.co/rh24jjET8t","1960614490514579846","https://pbs.twimg.com/media/GzWAe9wa4AMaEy8.jpg","","in","","0","0","0","https://x.com/undefined/status/1960614490514579846","3346124654",
"1960613253832130905","Wed Aug 27 08:00:00 +0000 2025","0","Gubernur Lemhanas Ace Hasan Ingatkan Ancaman Disinformasi dan Pentingnya Literasi Digital https://t.co/lQyaGoRfvV","1960613253832130905","","","in","","0","0","1","https://x.com/undefined/status/1960613253832130905","1953620240",
"1960611603902292048","Wed Aug 27 07:53:27 +0000 2025","3","Hai #FIUtizen! Menjual rekening bukan hanya tindakan sembrono itu bisa menyeretmu ke dalam kejahatan finansial seperti pencucian uang dan penipuan online. Jaga identitas digitalmu pahami risikonya dan tingkatkan literasi keuangan digital agar tidak menjadi korban atau https://t.co/LovmkYUwyj","1960611603902292048","https://pbs.twimg.com/media/GzV92UIa4AABj3i.jpg","","in","","0","4","1","https://x.com/undefined/status/1960611603902292048","213523321",
"1960606032821981512","Wed Aug 27 07:31:19 +0000 2025","0","Semangat luar! Literasi digital bergulir keamanan digital makin kuat Kita Nyaman Karena Aman https://t.co/CO3oFWKVrI","1960606032821981512","","","in","","0","0","0","https://x.com/undefined/status/1960606032821981512","1942481027022381057",
"1960603806435303901","Wed Aug 27 07:22:29 +0000 2025","0","Algoritma + kurangnya literasi digital bikin provokasi lebih cepat viral daripada fakta. Baca selengkapnya https://t.co/w88zFWzyN3 #Hoaks #MediaSosial #LiterasiDigital #FacebookPro","1960603809396506654","","agus_syahari","in","","0","0","0","https://x.com/undefined/status/1960603809396506654","1516405177435422723",
"1960503599160811974","Wed Aug 27 07:03:23 +0000 2025","0","@kompascom Pak Wamen sudah mengingatkan literasi digital memang kunci di era sekarang.dan mmng platform Tiktok paling bnyk jd konten penyebar hoax. Fitnah dan kebencian di medsos itu bahaya laten perlahan bisa merusak persatuan bangsa . Waspada HOAX.!! https://t.co/ol2elqC9to","1960599003038671288","https://pbs.twimg.com/media/GzVyZyta4AIEFyH.jpg","kompascom","in","","0","1","0","https://x.com/undefined/status/1960599003038671288","1957195516200243200",
"1960597584164040759","Wed Aug 27 06:58:08 +0000 2025","0","Riduan Direktur Utama Bank Mandiri menegaskan: Pencapaian ini adalah hasil kerja kolektif. Mandiri akan terus mendukung pembangunan nasional dengan memperkuat UMKM memperluas literasi digital dan memastikan layanan finansial menjangkau seluruh masyarakat Indonesia. ","1960597682323644770","","withsocialclub","in","","0","0","0","https://x.com/undefined/status/1960597682323644770","1598927041784852480",
"1960597308808249690","Wed Aug 27 06:57:14 +0000 2025","0","Riduan Direktur Utama Bank Mandiri menegaskan: Pencapaian ini adalah hasil kerja kolektif. Mandiri akan terus mendukung pembangunan nasional dengan memperkuat UMKM memperluas literasi digital dan memastikan layanan finansial menjangkau seluruh masyarakat Indonesia. ","1960597457223737801","","lanydenah","in","","0","0","0","https://x.com/undefined/status/1960597457223737801","1763869734544801792",
"1960597079522181534","Wed Aug 27 06:56:30 +0000 2025","0","Riduan Direktur Utama Bank Mandiri menegaskan: Pencapaian ini adalah hasil kerja kolektif. Mandiri akan terus mendukung pembangunan nasional dengan memperkuat UMKM memperluas literasi digital dan memastikan layanan finansial menjangkau seluruh masyarakat Indonesia. ","1960597270610764199","","AlaricA37487","in","","0","0","0","https://x.com/undefined/status/1960597270610764199","1824000639669821441",
"1960591882733408549","Wed Aug 27 06:35:05 +0000 2025","0","Hore! Literasi digital terus digenjot agar publik lebih paham hak dan tanggung jawab online. Kita Nyaman Karena Aman https://t.co/SBzhUJ5G0E","1960591882733408549","","","in","","0","0","0","https://x.com/undefined/status/1960591882733408549","1900891904671444995",
"1960591421573931322","Wed Aug 27 06:33:15 +0000 2025","0","Senangnya! Literasi digital diharap meningkat sejalan dengan keamanan aturan sehingga kita lebih siap. Kita Nyaman Karena Aman https://t.co/qobCDysbSN","1960591421573931322","","","in","","0","0","0","https://x.com/undefined/status/1960591421573931322","1099991570",
"1960591188299321389","Wed Aug 27 06:32:19 +0000 2025","0","Asik! Literasi digital jadi bagian dari pembangunan bangsa. Kita Nyaman Karena Aman https://t.co/ZxuFtTnFUP","1960591188299321389","","","in","","0","0","0","https://x.com/undefined/status/1960591188299321389","1878993938733727744",
"1960590926964736246","Wed Aug 27 06:31:17 +0000 2025","0","Wah! Literasi digital membuat kita lebih siap menghadapi risiko. Kita Nyaman Karena Aman https://t.co/xTkNCbE32w","1960590926964736246","","","in","","0","0","0","https://x.com/undefined/status/1960590926964736246","1617209436",
"1960477763351273619","Wed Aug 27 04:49:15 +0000 2025","0","@Merdeka2124 Blokir akses ke rekening dan situs judol oleh OJK dan Kominfo. Upaya edukasi dan literasi digital juga penting untuk meningkatkan kesadaran masyarakat terutama generasi muda mengenai dampak negatif judol. Yg sudah kecanduan harus mengurangi akses ke internet dulu... ","1960565250673029458","","Merdeka2124","in","","0","1","0","https://x.com/undefined/status/1960565250673029458","2556873745",
"1960527252845945273","Wed Aug 27 04:18:01 +0000 2025","0","@wibisonoys @kompascom @lpg @prabowo @PartaiGolkar Saya paham kekhawatiran soal kesiapan digitalisasi untuk kebijakan LPG 3kg dengan KTP mulai 2026. Data World Bank tunjukkan literasi digital Indonesia sekitar 50% (2023) dan masih ada yang belum punya NIK/KTP. Soal 43 PSN mangkrak laporan memang ada warisan proyek senilai","1960557390140727438","","wibisonoys","in","","0","1","0","https://x.com/undefined/status/1960557390140727438","1720665183188922368",
"1960527372702376361","Wed Aug 27 02:18:45 +0000 2025","1","Tanamkan Literasi Digital Sejak Dini UMKendari Sambut Siswa SMPIT Insantana Selengkapnya: https://t.co/mA6zDNzgMb https://t.co/Z74LPJgsUa","1960527372702376361","https://pbs.twimg.com/media/GzUxPsha4AYveMK.jpg","","in","","0","0","0","https://x.com/undefined/status/1960527372702376361","1461138289096749060",
"1960525414939680824","Wed Aug 27 02:10:58 +0000 2025","0","Wah! Literasi digital didorong masyarakat makin cerdas. Kita Nyaman Karena Aman https://t.co/ThtFnxlDxH","1960525414939680824","","","in","","0","0","0","https://x.com/undefined/status/1960525414939680824","1718450879517675520",
"1960524600821080156","Wed Aug 27 02:08:12 +0000 2025","0"," yang bertujuan meningkatkan literasi digital di Jawa Timur serta mendukung pemanfaatan teknologi AI. https://t.co/oDZPyIEiIp","1960524719247286318","https://pbs.twimg.com/media/GzUuvg9a4AAniia.jpg","KominfoJatim","in","","0","0","0","https://x.com/undefined/status/1960524719247286318","1569962529178402817",
"1960524534601408607","Wed Aug 27 02:07:28 +0000 2025","0","Mantul! Literasi digital membuat semua pengguna lebih cerdas dan percaya diri. Kita Nyaman Karena Aman https://t.co/f2ztTph3cC","1960524534601408607","","","in","","0","0","0","https://x.com/undefined/status/1960524534601408607","1923549910533799936",
"1960523960384413884","Wed Aug 27 02:05:11 +0000 2025","0","Sering gak sih merasa gak nyambung saat ngobrol dgn anak? Hal ini bisa saja terjadi karena adanya gap literasi digital antara orang tua &amp; anak. Ini saatnya untuk memahami teknologi dasar dan bangun bonding dengan anak Parents! #LiterasiDigital #DiskominfoKotaBogor https://t.co/AgzNOTWj7R","1960523960384413884","https://pbs.twimg.com/media/GzUuJJaa4AMj33g.jpg","","in","","0","0","0","https://x.com/undefined/status/1960523960384413884","2479106588",
"1960523271306404041","Wed Aug 27 02:02:27 +0000 2025","0","Hore! Literasi digital meningkat masyarakat makin cerdas. Kita Nyaman Karena Aman https://t.co/LG9O2f6xlb","1960523271306404041","","","in","","0","0","0","https://x.com/undefined/status/1960523271306404041","1908913654717956096",
"1960523257670689157","Wed Aug 27 02:02:24 +0000 2025","0","Hore! Literasi digital makin maju semua makin paham dunia maya. Kita Nyaman Karena Aman https://t.co/ZUoi501t9i","1960523257670689157","","","in","","0","0","0","https://x.com/undefined/status/1960523257670689157","1924050331203489792",
"1960523235591897117","Wed Aug 27 02:02:18 +0000 2025","0","Hore! Literasi digital makin maju masyarakat makin cerdas. Kita Nyaman Karena Aman https://t.co/utnz9TqErP","1960523235591897117","","","in","","0","0","0","https://x.com/undefined/status/1960523235591897117","1908585849878700033",
"1960522610393145383","Wed Aug 27 01:59:49 +0000 2025","0","Asyik! Literasi digital jadi prioritas masyarakat makin cerdas. Kita Nyaman Karena Aman https://t.co/xCHyAiPOYN","1960522610393145383","","","in","","0","0","0","https://x.com/undefined/status/1960522610393145383","584201817",
"1960522443812167682","Wed Aug 27 01:59:10 +0000 2025","0","Asyik banget! Literasi digital makin digemari semua jadi lebih paham teknologi. Kita Nyaman Karena Aman https://t.co/abUxTKngN0","1960522443812167682","","","in","","0","0","0","https://x.com/undefined/status/1960522443812167682","1908573288407920640",
"1960522173908668748","Wed Aug 27 01:58:05 +0000 2025","0","Asik! Literasi digital makin digemari semua jadi lebih paham teknologi. Kita Nyaman Karena Aman https://t.co/bbATXWkO0y","1960522173908668748","","","in","","0","0","0","https://x.com/undefined/status/1960522173908668748","1923565606038798336",
"1960510779037475190","Wed Aug 27 01:12:48 +0000 2025","0","Rumah Literasi Digital Surabaya Dorong Jurnalis Jadi Garda Terdepan Edukasi Publik @TV9NUsantara https://t.co/v1EeYJifQr","1960510779037475190","","","in","","0","0","1","https://x.com/undefined/status/1960510779037475190","1749334907271380992",
"1960505290228699568","Wed Aug 27 00:51:00 +0000 2025","1","Disertasi Smart City Surabaya di Unair: Ian Firstian Soroti Peran OPD Dorong Integrasi Aplikasi Layanan Publik dan Literasi Digital https://t.co/6M0d3BpsYX","1960505290228699568","","","in","","0","0","0","https://x.com/undefined/status/1960505290228699568","2392460208",
"1960494787930546634","Wed Aug 27 00:09:17 +0000 2025","0","Pertanyaan yang bias akan menghasilkan jawaban yang bias.Menguasai literasi data adalah senjata terpenting di ranah digital. Tujuan kita bukan berdebat soal angka tapi memahami bagaimana informasi bisa dimanipulasi.","1960494793055977664","","gundala_sipetir","in","","0","0","0","https://x.com/undefined/status/1960494793055977664","962747430",
"1960319763856478422","Tue Aug 26 23:16:31 +0000 2025","0","@unesa_fess Aku ada literasi digital sama pancasila","1960481514531250638","","unesa_fess","in","","0","0","0","https://x.com/undefined/status/1960481514531250638","1291960057748262912",
"1960451507805151728","Tue Aug 26 21:17:17 +0000 2025","1","Sebanyak 11 program dan projek dirancang dengan tumpuan kepada Sains Teknologi Kejuruteraan dan Matematik (STEM) serta literasi digital. #AWANInews #AWANIpagi https://t.co/OLkYH4O10z","1960451507805151728","","","in","","0","1","1","https://x.com/undefined/status/1960451507805151728","497665754",
"1960371807237587240","Tue Aug 26 16:09:02 +0000 2025","0","@unesa_fess Literasi digital berapaan nder","1960373932038803784","","unesa_fess","in","","0","1","0","https://x.com/undefined/status/1960373932038803784","1462423735097434116",
"1960319763856478422","Tue Aug 26 14:14:35 +0000 2025","0","@unesa_fess aku ada buku agama islam sama literasi digital","1960345130508100067","","unesa_fess","in","","0","1","0","https://x.com/undefined/status/1960345130508100067","1384962773881266176",
"1960301601874206956","Tue Aug 26 11:22:36 +0000 2025","0","@Ingchuen Kominfo punya peran penting dalam regulasi telekomunikasi promosi literasi digital dan penanganan misinformasi di Indonesia. Contohnya mereka blokir ribuan situs judi online dan dorong transformasi digital. Tapi kritik banyak soal lambat tangani kebocoran data (kayak PDN","1960301850038841729","","Ingchuen","in","","1","0","0","https://x.com/undefined/status/1960301850038841729","1720665183188922368",
"1960295079782007185","Tue Aug 26 11:04:29 +0000 2025","0","@weegledocs padahal ini grup kelas tuweb matkul belajar di era digital tp minim literasi bngt","1960297292117709094","","weegledocs","in","","0","1","0","https://x.com/undefined/status/1960297292117709094","1569278209858076672",
"1960278970181566492","Tue Aug 26 09:51:41 +0000 2025","0","Dompet digital Poket menjadi inovasi baru Amartha dalam menyediakan layanan keuangan digital yang lengkap dan inklusif. #Ekonomi #AdadiKompas https://t.co/FJ25SaWDan","1960278970181566492","","","in","","0","0","0","https://x.com/undefined/status/1960278970181566492","155456716",
"1960277244028375238","Tue Aug 26 09:44:49 +0000 2025","0","Dompet digital Poket menjadi inovasi baru Amartha dalam menyediakan layanan keuangan digital yang lengkap dan inklusif. #Ekonomi #AdadiKompas https://t.co/DRoQiwUY5V","1960277244028375238","","","in","","0","0","0","https://x.com/undefined/status/1960277244028375238","255866913",
"1960276308182622571","Tue Aug 26 09:41:06 +0000 2025","0","Dompet digital Poket menjadi inovasi baru Amartha dalam menyediakan layanan keuangan digital yang lengkap dan inklusif. #Ekonomi #AdadiKompas https://t.co/yPWsAWEyz8","1960276308182622571","","","in","","0","0","0","https://x.com/undefined/status/1960276308182622571","771030588",
"1960274686484566286","Tue Aug 26 09:34:40 +0000 2025","1","Dalam upaya mendorong inklusi dan literasi keuangan berbasis teknologi PT Bank Rakyat Indonesia (Persero) Tbk atau BRI menjalin kolaborasi kerja sama dengan INDODAX salah satu platform jual-beli aset kripto di Indonesia. Selengkapnya https://t.co/vuwibu8Zrk","1960274686484566286","","","in","","0","1","0","https://x.com/undefined/status/1960274686484566286","1169861863426818048",
"1960206359376679401","Tue Aug 26 09:18:00 +0000 2025","0","@fideldapati @prabowo @puanmaharani_ri @PDI_Perjuangan @Gerindra @DPP_PKB @PKSejahtera @NasDem @PartaiPAN Ajukan saja ke MK pak jika ingin merubah konstitusi. Uji argumentasinya. Lebih sehat pakai otak daripada otot lebih bagus perbanyak literasi digital kumpulkan data dan ajukan keberatan minta jumlah anggota DPR dikurangi. Ayo semangat!","1960270495305081269","","fideldapati","in","","0","0","0","https://x.com/undefined/status/1960270495305081269","721898354502930433",
"1960263760163336592","Tue Aug 26 08:51:18 +0000 2025","0","Pembina E-Sport KORPRI 2025 Anton Martin SE. MH. yang memberikan materi Pertandingan Esport. Robertus berharap dalam kegiatan esport ini mampu membangkitkan jiwa dan semangat para ASN sekaligus menjadi wadah pengembangan literasi digital","1960263775128576371","","kpukabsidoarjo","in","","0","1","0","https://x.com/undefined/status/1960263775128576371","721894741378355204",
"1960247424183640445","Tue Aug 26 07:46:20 +0000 2025","0","semoga kelompok literasi digital ini sama enaknya kayak kelompok mpkt","1960247424183640445","","","in","","0","0","0","https://x.com/undefined/status/1960247424183640445","870048704559894528",
"1960237538137743642","Tue Aug 26 07:07:03 +0000 2025","0","@BSSN_RI kita udah capek jadi korban sistem digital yang bebas tanpa batas. Tolong buat langkah pasti dan lindungi publik. https://t.co/Sz6dCjVHg9","1960237538137743642","","BSSN_RI","in","","0","0","0","https://x.com/undefined/status/1960237538137743642","195331310",
"1960237507833974820","Tue Aug 26 07:06:55 +0000 2025","0","Serem ya kejahatan digital sekarang bisa viral lebih cepet daripada klarifikasi. Negara harus lebih duluan dari pelaku. https://t.co/lDcbhAKZda","1960237507833974820","","","in","","0","0","0","https://x.com/undefined/status/1960237507833974820","584201817",
"1960237481736986914","Tue Aug 26 07:06:49 +0000 2025","0","Dunia digital tuh kayak hutan belantara sekarang. Kita butuh peta pagar dan penjaga. Regulasi dasar itu kuncinya. https://t.co/zQxO0l88N5","1960237481736986914","","","in","","0","0","0","https://x.com/undefined/status/1960237481736986914","1309728618",
"1960237468281688142","Tue Aug 26 07:06:46 +0000 2025","0","Deepfake makin nyata tapi aturan mainnya mana? Jangan sampe masyarakat jadi tumbal era digital. https://t.co/5lLKMQSv6N","1960237468281688142","","","in","","0","0","0","https://x.com/undefined/status/1960237468281688142","1662320706",
"1960237442285326609","Tue Aug 26 07:06:40 +0000 2025","0","Warganet makin melek teknologi tapi perlindungan digital dari negara masih kurang cepet. Harus ada langkah konkret. https://t.co/H3fUPIizyr","1960237442285326609","","","in","","0","0","0","https://x.com/undefined/status/1960237442285326609","1099991570",
"1960237416133886366","Tue Aug 26 07:06:34 +0000 2025","0","Beneran insecure wajah bisa dicomot suara bisa ditiru terus dijadiin senjata digital. Perlu perlindungan yang kuat bukan sekadar saran. https://t.co/fwKPnltazJ","1960237416133886366","","","in","","0","0","0","https://x.com/undefined/status/1960237416133886366","1617209436",
"1960237402556940437","Tue Aug 26 07:06:30 +0000 2025","0","Kalo video kayak Sri Mulyani aja bisa dipalsuin segitu real-nya siapa yang bisa jamin kita aman dari manipulasi digital? https://t.co/mEL1mO8ZnJ","1960237402556940437","","","in","","0","0","0","https://x.com/undefined/status/1960237402556940437","569263592",
"1960237384894759373","Tue Aug 26 07:06:26 +0000 2025","0","Deepfake itu bukan cuma ngedit video lucu. Ini bisa bikin hancur reputasi orang. Negara harus turun tangan bukan cuma nontonin. https://t.co/OCsINzaZe0","1960237384894759373","","","in","","0","0","0","https://x.com/undefined/status/1960237384894759373","1338564582",
"1960237367140241669","Tue Aug 26 07:06:22 +0000 2025","0","Teknologi makin canggih tapi kita makin susah percaya sama apa yang kita lihat. Deepfake bikin hidup digital makin penuh curiga. https://t.co/KcE6ZQPvuA","1960237367140241669","","","in","","0","0","0","https://x.com/undefined/status/1960237367140241669","1071077515",
"1960222567970623962","Tue Aug 26 06:07:34 +0000 2025","0","Kita semua butuh rasa aman di dunia digital bukan cuma himbauan atau literasi doang. Tindakan nyata please! https://t.co/KPCKLXhnbq","1960222567970623962","","","in","","0","0","0","https://x.com/undefined/status/1960222567970623962","1908936942206464001",
"1960215674678399109","Tue Aug 26 05:45:05 +0000 2025","0"," Kami berkomitmen meningkatkan literasi digital menyajikan informasi yang akurat dan menangkal hoaks serta framing negatif yang dapat mengganggu kepercayaan masyarakat ujarnya. #BRMPSayuran #PPIDKementan #KementanRI #InformasiPublik #StopHoaks","1960216913877057794","","brmpsayuran","in","","0","0","0","https://x.com/undefined/status/1960216913877057794","1823559306190708736",
"1960194138441208265","Tue Aug 26 04:14:35 +0000 2025","0","Kehadiran kartu debit co-branding BRI X INDODAX merupakan langkah nyata BRI dalam mendukung pertumbuhan literasi aset digital di Indonesia. #Taja #AdadiKompas https://t.co/z0wVVDGwyP","1960194138441208265","","","in","","0","0","0","https://x.com/undefined/status/1960194138441208265","255866913",
"1960193605177360501","Tue Aug 26 04:12:28 +0000 2025","0","Kehadiran kartu Debit Co-Branding BRI X INDODAX merupakan langkah nyata BRI dalam mendukung pertumbuhan literasi aset digital di Indonesia. #Ekonomi #AdadiKompas https://t.co/2KaEnWBNjb","1960193605177360501","","","in","","0","0","0","https://x.com/undefined/status/1960193605177360501","155456716",
"1960190900287447380","Tue Aug 26 04:01:43 +0000 2025","0","Kehadiran kartu Debit Co-Branding BRI X INDODAX merupakan langkah nyata BRI dalam mendukung pertumbuhan literasi aset digital di Indonesia. #Ekonomi #AdadiKompas https://t.co/7m0XztN8hz","1960190900287447380","","","in","","0","0","0","https://x.com/undefined/status/1960190900287447380","771030588",
"1959821458374562066","Mon Aug 25 03:33:42 +0000 2025","0","Edukasi literasi digital buat orang tua udah darurat. https://t.co/VkXK7j7O34","1959821458374562066","","","in","","0","0","0","https://x.com/undefined/status/1959821458374562066","1908737794379227136",
"1958492376088879467","Mon Aug 25 03:32:36 +0000 2025","0","@kemkomdigi Kebijakan Kemkomdigi berperan krusial dalam membangun infrastruktur digital yang kuat serta meningkatkan literasi digital masyarakat. Semoga terus mendorong inovasi dan transformasi digital demi kemajuan Indonesia","1959821182636863691","","kemkomdigi","in","","0","0","0","https://x.com/undefined/status/1959821182636863691","1672697617795649536",
"1959119754805092784","Mon Aug 25 03:27:55 +0000 2025","0","@kemkomdigi Keren! Pelatihan literasi digital untuk koperasi ini sangat dibutuhkan. Semoga KDMP Karangbesuki jadi contoh bagi daerah lain ","1959820005924905164","","kemkomdigi","in","","0","0","0","https://x.com/undefined/status/1959820005924905164","1693280402604183552",
"1959119754805092784","Mon Aug 25 03:22:36 +0000 2025","0","@kemkomdigi Keren! Pelatihan literasi digital untuk koperasi ini sangat dibutuhkan. Semoga KDMP Karangbesuki jadi contoh bagi daerah lain ","1959818667975475494","","kemkomdigi","in","","0","0","0","https://x.com/undefined/status/1959818667975475494","1826220655114960896",
"1958492376088879467","Mon Aug 25 03:21:32 +0000 2025","0","@kemkomdigi Kemkomdigi berperan krusial dalam membangun infrastruktur digital yang kuat dan meningkatkan literasi digital masyarakat. Semoga terus mendorong inovasi dan transformasi digital untuk kemajuan Indonesia.","1959818397883289983","","kemkomdigi","in","","0","0","0","https://x.com/undefined/status/1959818397883289983","1896746162671300608",
"1959119754805092784","Mon Aug 25 03:15:47 +0000 2025","0","@kemkomdigi Mantap pembukuan digital untuk koperasi memang bikin lebih transparan dan akuntabel. Salut buat Kementerian Komunikasi dan Digital yang terus memperkuat literasi digital apalagi lewat pelatihan di Koperasi Desa Merah Putih Karangbesuki Sukun Malang","1959816952375132303","","kemkomdigi","in","","0","0","0","https://x.com/undefined/status/1959816952375132303","1672697617795649536",
"1959119754805092784","Mon Aug 25 03:12:13 +0000 2025","0","@kemkomdigi Program literasi digital seperti ini sangat bermanfaat Koperasi jadi makin transparan modern dan bisa dipercaya oleh anggota maupun masyarakat.","1959816053120463218","","kemkomdigi","in","","0","0","0","https://x.com/undefined/status/1959816053120463218","1936732324785467392",
"1959119754805092784","Mon Aug 25 03:06:47 +0000 2025","0","@kemkomdigi Langkah bagus literasi digital bikin koperasi makin modern dan transparan","1959814686515527908","","kemkomdigi","in","","0","0","0","https://x.com/undefined/status/1959814686515527908","1820805525698912256",
"1959119754805092784","Mon Aug 25 03:06:32 +0000 2025","0","@kemkomdigi Innovatif! Literasi digital untuk koperasi adalah langkah maju.Maju terus Kemkomdigi.digitalisasi koperasi amat diperlukan.","1959814622862782722","","kemkomdigi","in","","0","0","0","https://x.com/undefined/status/1959814622862782722","1321816076515119106",
