"conversation_id_str","created_at","favorite_count","full_text","id_str","image_url","in_reply_to_screen_name","lang","location","quote_count","reply_count","retweet_count","tweet_url","user_id_str","username"
"1963461268221669878","Thu Sep 04 04:37:00 +0000 2025","1","#AI #literacy for law students is not just about preparing them for courtrooms and corporate negotiations but also equipping them to serve and protect the public grappling with new forms of digital deception writes BMU faculty Saraswathy Vaidyanathan in @LegalBW","1963461268221669878","","","en","","0","0","0","https://x.com/undefined/status/1963461268221669878","2231346036",
"1963459506383331558","Thu Sep 04 04:30:00 +0000 2025","8","In a world going digital Uganda can t afford to be left behind. Join us as we unpack how digital literacy or the lack of it; shapes opportunities dreams &amp; futures. @RuthAtim &amp; @BonifaceKilama1 @USAlumniUganda in digital spaces will illuminate this reality guided by @Ronnie_Ug https://t.co/VtRY4ibePt","1963459506383331558","https://pbs.twimg.com/media/Gz7dzy-XEAEC8NP.jpg","","en","","0","0","2","https://x.com/undefined/status/1963459506383331558","1926290250323607552",
"1963459341601890763","Thu Sep 04 04:29:21 +0000 2025","0","These are the activities of all 25 participants in Banlung engaged in the training workshop on Media Information and Digital Literacy for People with Disabilities (MIDL4PWD) on 14 August 2025 ️ #MIDL4PWD #Ratanakiri #UNDP #EmbassyOfJapan #ODC https://t.co/J0Xiw8fE8h","1963459341601890763","https://pbs.twimg.com/media/Gz-bsptbkAEkPPe.jpg","","en","","0","0","0","https://x.com/undefined/status/1963459341601890763","355898177",
"1963452239026295149","Thu Sep 04 04:01:07 +0000 2025","0","Now I'm on Gumroad too! Everything You Wanted To know About Digital Literacy: And You Were Afraid To Ask on @Gumroad https://t.co/fSzVdV6ULw Grab your copy NOW!!!","1963452239026295149","","","en","","0","0","0","https://x.com/undefined/status/1963452239026295149","798449888216236032",
"1963452077419516187","Thu Sep 04 04:00:29 +0000 2025","0","UTAMU is Soaring Higher Empowering Legal Innovation! In partnership with the Uganda Law Society UTAMU proudly launches two groundbreaking programmes today at Uganda Law Society House. Postgraduate Certificate in Digital Literacy for Lawyers. Postgraduate Certificate in AI https://t.co/j43iyzz5c3","1963452077419516187","https://pbs.twimg.com/media/Gz-VOz3WwAAAM5O.jpg","","en","","0","0","0","https://x.com/undefined/status/1963452077419516187","822795830",
"1963446402840695074","Thu Sep 04 03:37:56 +0000 2025","0","Key future skills: 1. Data literacy 2. Digital communication 3. Adaptability 4. Critical thinking https://t.co/WH9C023M5k","1963446403851575562","https://pbs.twimg.com/media/Gz-QFOCWAAArIDp.jpg","gsseduorg","en","","0","1","0","https://x.com/undefined/status/1963446403851575562","1526632282911432704",
"1960585117426180453","Thu Sep 04 02:03:47 +0000 2025","0","@putriraahayu @GiveRep Crypto should be accessible to people with limited digital literacy. Interfaces that guide users step by step @GiveRep","1963422710899564710","","putriraahayu","en","","0","0","0","https://x.com/undefined/status/1963422710899564710","2151236957",
"1963417497652101516","Thu Sep 04 01:43:04 +0000 2025","0","Digital Citizenship in Action at @KayGrangerElem @shannon_sprowls is leading Lesson 2 on copyright + AI literacy Students are learning: What AI is Why it s not always accurate How to create responsibly with AI #1toWorldPromise #AILiteracy #NISDIT https://t.co/EjyUYeFU1x","1963417497652101516","https://pbs.twimg.com/media/Gz91nUaWwAE0Mfi.jpg","","en","","0","0","0","https://x.com/undefined/status/1963417497652101516","356370999",
"1963407917178392959","Thu Sep 04 01:24:43 +0000 2025","0","@_globalimpact @MarioNawfal Australia's under-16 social media ban set for December 2025 could have mixed global long-term effects. Positively it might boost mental health and real-world skills by curbing harms like cyberbullying (per health experts). Negatively it risks stunting digital literacy ","1963412878637371461","","_globalimpact","en","","0","0","0","https://x.com/undefined/status/1963412878637371461","1720665183188922368",
"1963231740673364116","Thu Sep 04 00:49:36 +0000 2025","0","@LuizaJarovsky This shows how crucial it is to teach digital literacy.","1963404039707652212","","LuizaJarovsky","en","","0","0","0","https://x.com/undefined/status/1963404039707652212","1425887179763503106",
"1963345121031897274","Thu Sep 04 00:32:38 +0000 2025","5","@136weasels @H0NEYFANGS The best way to handle this is to encourage more in-depth digital literacy and coping mechanisms as well as more definitive education on the things teenagers get curious about. That way even if they decide to venture out they can still protect themselves from being harmed -","1963399770430738465","","wwooottt","en","","0","1","0","https://x.com/undefined/status/1963399770430738465","1506576779036991489",
"1963392753209082150","Thu Sep 04 00:04:45 +0000 2025","0","Education equips individuals with the skills to navigate the digital world including media literacy and online safety. #ForBetterLiving https://t.co/9yNSmRvIK9","1963392753209082150","https://pbs.twimg.com/media/Gz9fR3Ib0AArusE.jpg","","en","","0","0","0","https://x.com/undefined/status/1963392753209082150","1952480245459951616",
"1963391820726931606","Thu Sep 04 00:01:02 +0000 2025","0","Technology training for seniors keeps families connected and creates new economic opportunities. Digital literacy programs cybersecurity education and user-friendly interfaces bring older Americans into the modern economy.","1963391820726931606","","","en","","0","0","0","https://x.com/undefined/status/1963391820726931606","1953529760665006080",
"1963388909934739919","Wed Sep 03 23:49:28 +0000 2025","0","When a character s struggle with digital literacy highlights real-world education gaps in your community @PlayWildcard https://t.co/QDwsnp6IKG","1963388909934739919","https://pbs.twimg.com/media/Gz9bysPbgAAxRQL.jpg","","en","","0","0","0","https://x.com/undefined/status/1963388909934739919","2239601095",
"1963174648792662159","Wed Sep 03 23:09:36 +0000 2025","0","@NigeriaStories they want to bring all of these to the school where we lack the man power/teachers who knows nothing about digital literacy","1963378877956346210","","NigeriaStories","en","","0","0","0","https://x.com/undefined/status/1963378877956346210","1594248026532495367",
"1961662925279728048","Wed Sep 03 22:57:45 +0000 2025","0","@berbig24762 digital media literacy huh? seems like a overcomplicated way to say just think before you click right?","1963375894321664261","","berbig24762","en","","0","0","0","https://x.com/undefined/status/1963375894321664261","1773768393419788288",
"1963375694500573307","Wed Sep 03 22:56:57 +0000 2025","0","Digital literacy and coding tech and innovation ai ? Yes it good but for now it a misplaced priority When the educational sector is in shambles The infrastructure is not there This will never work","1963375694500573307","","","en","","1","0","0","https://x.com/undefined/status/1963375694500573307","1803073181478957056",
"1963367160212029557","Wed Sep 03 22:23:03 +0000 2025","0","Nigeria just changed its school curriculum. Fewer subjects History is back 15 new vocational skills (solar bakery GSM repair digital literacy) No more BECE A THREAD YOU MUST READ!! #Bridgingthegap https://t.co/gmyf5prgdL","1963367160212029557","https://pbs.twimg.com/media/Gz9H4ytWUAAzVEL.jpg","","en","","0","1","0","https://x.com/undefined/status/1963367160212029557","1923666889445625856",
"1963357764392292613","Wed Sep 03 21:45:43 +0000 2025","0","The Nigerian Federal Government has released a comprehensive new academic curriculum for Junior Secondary School (JSS) and Senior Secondary School (SSS) set to commence in the 2025 academic session. SEE FULL LIST https://t.co/aVnQwmCuHq","1963357764392292613","","","en","","0","0","0","https://x.com/undefined/status/1963357764392292613","1898948423271034880",
"1963353812028076404","Wed Sep 03 21:30:00 +0000 2025","2","Check it. Teachers are key to students' AI literacy and need support https://t.co/rvUQcqYLp0 via @physorg_com #tech #digital #data #privacy","1963353812028076404","","","en","","0","0","1","https://x.com/undefined/status/1963353812028076404","135922295",
"1963353303124672562","Wed Sep 03 21:27:59 +0000 2025","0","Federal Government has added digital literacy and coding to our new school curriculum for JSS and SSS... History health education also added. https://t.co/aBKPZA7gSd","1963353303124672562","https://pbs.twimg.com/media/Gz87aQtXUAAQigr.jpg","","en","","0","0","0","https://x.com/undefined/status/1963353303124672562","1732094380649967616",
"1963352881861726306","Wed Sep 03 21:26:19 +0000 2025","0","Explore the ways in which the project is promoting digital literacy to empower users in the blockchain space @Giverep","1963352881861726306","","","en","","0","1","0","https://x.com/undefined/status/1963352881861726306","1347960073",
"1962993682401132976","Wed Sep 03 21:21:01 +0000 2025","0","@HighChiefOkoro Digital literacy in Jss is a game changer.","1963351549742342364","","HighChiefOkoro","en","","0","0","0","https://x.com/undefined/status/1963351549742342364","41547923",
"1963349561486782551","Wed Sep 03 21:13:07 +0000 2025","2","Your library = the ultimate digital literacy HQ this back-to-school season. We ve got 5 creative ways to transform your space for families during Open House &amp; Curriculum Night QR codes interactive stations slideshows &amp; more! Read the blog ️ https://t.co/JILOtuXcJy https://t.co/azSchiKjxk","1963349561486782551","https://pbs.twimg.com/media/Gz84AUwWYAA6Ef5.jpg","","en","","0","0","1","https://x.com/undefined/status/1963349561486782551","2786883008",
"1963341106026090577","Wed Sep 03 20:39:31 +0000 2025","2","P7 were developing line drawing skills this morning having selected an inanimate object to sketch. Their next steps incorporate digital literacy skills; we can t wait to see where they go with this! ️ https://t.co/ieRDcy42lf","1963341106026090577","https://pbs.twimg.com/media/Gz8wU4QXIAAjAuP.jpg","","en","","0","0","0","https://x.com/undefined/status/1963341106026090577","730742113059651585",
"1963227633736376444","Wed Sep 03 20:32:55 +0000 2025","3","@GBNEWS So what s the comprehensive plan to ensure this digital ID system is accessible and inclusive for everyone including vulnerable populations like people with disabilities older adults who aren t comfortable with smartphones or online platforms those with low digital literacy ","1963339445186564556","","GBNEWS","en","","0","4","0","https://x.com/undefined/status/1963339445186564556","1876741534780956672",
"1963335308927291467","Wed Sep 03 20:16:30 +0000 2025","0","The focus was on skill-building startup funding and digital innovation aligned with Edo State s SHINE Agenda. Key takeaways for NYCN Edo South : Skill Development: Exposure to AI cybersecurity and digital literacy.","1963335312303591716","","NYCNEdosouth","en","","0","1","0","https://x.com/undefined/status/1963335312303591716","1950021010616446976",
"1963331183435255984","Wed Sep 03 20:00:05 +0000 2025","0","We are thrilled to offer our Digital Literacy Support Program designed especially for older adults who want to feel more confident using phones tablets or computers. In partnership with Baycrest this program provides one-on-one coaching tailored to your needs whether you re https://t.co/ZQ1K36mRie","1963331183435255984","https://pbs.twimg.com/media/Gz8hD7ZWcAAwVJU.jpg","","en","","0","0","0","https://x.com/undefined/status/1963331183435255984","2853269411",
"1963325375674753276","Wed Sep 03 19:37:01 +0000 2025","0","Journalism will now be part of English Language module and the newly created Digital Literacy comprising Programming AI and Robotics in Secondary schools. This reforms will equip Nigerian students with skills relevant to a technology-driven world. https://t.co/OX2xtPlTpo https://t.co/wNuVQsk2PX","1963325375674753276","https://pbs.twimg.com/media/Gz8iBIrXoAAjX8r.jpg","","en","","0","0","0","https://x.com/undefined/status/1963325375674753276","1712632349853089792",
"1963174648792662159","Wed Sep 03 19:36:19 +0000 2025","0","@djlydtv @NigeriaStories Yes recent reports from Nigerian news outlets like The Guardian and Punch confirm the Federal Government unveiled a new curriculum on Sunday adding compulsory digital literacy and entrepreneurship for JSS plus programming AI and languages for SSS effective September 2025.","1963325202923962555","","djlydtv","en","","0","0","0","https://x.com/undefined/status/1963325202923962555","1720665183188922368",
"1961637928834339025","Wed Sep 03 19:27:49 +0000 2025","0","@ChristalLa30358 yeah cause we all have time for digital literacy when basic math is still hard for most people","1963323060884508809","","ChristalLa30358","en","","0","0","0","https://x.com/undefined/status/1963323060884508809","1773770450306232320",
"1963322070252544140","Wed Sep 03 19:23:52 +0000 2025","0","Nigeria unveils a future-ready curriculum JSS1 students must take at least 1 trade subject (solar fashion livestock cosmetology ICT repairs horticulture) Digital literacy robotics &amp; AI now included Curriculum streamlined for practical + academic balance https://t.co/BTuMvCchZB","1963322070252544140","https://pbs.twimg.com/media/Gz8e9O9XEAAzS3U.png","","en","","0","0","0","https://x.com/undefined/status/1963322070252544140","1920866196175634432",
"1963321271447355420","Wed Sep 03 19:20:42 +0000 2025","0","A new ITU report warns that universal internet connectivity by 2030 will require trillions in investment with over 2.6B people offline. Priorities include fibre 4G satellites affordability and digital literacy - Developing Telecoms https://t.co/ay14OMlsYc","1963321271447355420","","","en","","0","0","0","https://x.com/undefined/status/1963321271447355420","1381309297267777545",
"1962888043041325217","Wed Sep 03 19:15:36 +0000 2025","0","@DesireeAmerica4 She's a corn star and this was set up digital media literacy ppl dang","1963319986698822032","","DesireeAmerica4","en","","0","0","0","https://x.com/undefined/status/1963319986698822032","1589691045314711552",
"1963319473961619780","Wed Sep 03 19:13:33 +0000 2025","4","We commend @RwenzururuK for this timely commitment to safeguarding our mother tongue Lhukonzo. As Rwenzururu Center for Innovation &amp; Development (RCID) we stand ready to partner in: Developing digital tools for Lhukonzo learning. Supporting literacy initiatives in","1963319473961619780","","","en","","0","1","1","https://x.com/undefined/status/1963319473961619780","1937990171582238720",
"1963316037023301748","Wed Sep 03 19:00:00 +0000 2025","0","The real challenge? Making sure nurses are not left behind in the digital healthcare transition. That means: - Digital literacy training - Policy inclusion ️ - Nursing leadership in tech adoption ","1963316063539794137","","FellowNurses1","en","","0","1","0","https://x.com/undefined/status/1963316063539794137","890975374091354112",
"1963313135412285906","Wed Sep 03 18:48:32 +0000 2025","54","Short-Term vs. Long-Term Impact Not all these points deliver returns on the same timeline. Elements like Distinct Digital Identity Collector Engagement and Blockchain Literacy can quickly boost sales and visibility. Others such as Deep Narratives Immersive Exhibitions and","1963313175757050323","","trevorjonesart","en","","0","2","0","https://x.com/undefined/status/1963313175757050323","150713367",
"1963312463388045822","Wed Sep 03 18:45:42 +0000 2025","0","Reuben Kigame emphasizes education for all ages. On #KIGAMEsPLAN he advocates for adult literacy and digital skills training. https://t.co/UZ9xYTJ0ON","1963312463388045822","https://pbs.twimg.com/media/Gz8WRjHWUAAz0nr.jpg","","en","","0","0","3","https://x.com/undefined/status/1963312463388045822","1297387735557316608",
"1963310122391728353","Wed Sep 03 18:36:24 +0000 2025","0","- Compulsory digital literacy and basic entrepreneurship for JSS - Programming AI Languages for SSS The new curriculum for Nigerian Schools which will commence from the next session in September 2025 has been released. https://t.co/aFWJPumvxD","1963310122391728353","https://pbs.twimg.com/media/Gz8UJTMWUAAsnMZ.jpg","","en","","0","0","0","https://x.com/undefined/status/1963310122391728353","3332275528",
"1963003213310996839","Wed Sep 03 18:25:59 +0000 2025","0","@BaronJTrump over 3 billion in his personal profit from Hawking his digital coins he markets to his mostly below 6th grade literacy","1963307503221182955","","BaronJTrump","en","","0","0","0","https://x.com/undefined/status/1963307503221182955","1917689365519818754",
"1963306941557412029","Wed Sep 03 18:23:46 +0000 2025","0","Digital literacy and coding nice improvement to the education of the leaders of tomorrow","1963306941557412029","","","en","","0","1","0","https://x.com/undefined/status/1963306941557412029","1501594884310020097",
"1963298726417457300","Wed Sep 03 18:07:01 +0000 2025","0","@_globalimpact @jk_rowling Effective interventions include: - Platform policies: Enhanced content moderation AI detection and swift removal of hate speech (UN UNESCO guidelines). - Education: Programs to build digital literacy and critical thinking to counter narratives (UNESCO). - Counterspeech:","1963302727917998526","","_globalimpact","en","","0","0","0","https://x.com/undefined/status/1963302727917998526","1720665183188922368",
"1963301659888488713","Wed Sep 03 18:02:46 +0000 2025","0","Digital Literacy AI Entrepreneurship Now Compulsory in FG's Rejigged School Curriculum https://t.co/n8vueLVrne","1963301659888488713","","","en","","0","0","0","https://x.com/undefined/status/1963301659888488713","1893332538954825728",
"1963281721551659489","Wed Sep 03 18:02:25 +0000 2025","1","@HeatherTomli There are a lot of factors. It's easy to blame phones but some problems actually predate the digital era. I remember my poor former hairdresser's daughter desperately wanted to learn but the school didn't even give her basic phonics so she was just drifting in semi-literacy.","1963301572269789502","","HeatherTomli","en","","0","1","0","https://x.com/undefined/status/1963301572269789502","1554492428530466823",
"1963301161252860026","Wed Sep 03 18:00:47 +0000 2025","1","Want to learn new digital skills? SLDC and MoveWorth are offering FREE Digital Literacy Training for St. Louis residents! Whether you re a student working adult or senior our classes are designed to help you get connected and succeed in today s digital world. ️ Choose from https://t.co/HWabMbdSAW","1963301161252860026","https://pbs.twimg.com/media/Gz8MAAbXAAAgOaW.jpg","","en","","0","0","1","https://x.com/undefined/status/1963301161252860026","1572279531800494081",
"1963295989235654732","Wed Sep 03 17:40:14 +0000 2025","0","Teen mental health is under more pressure than ever. Screen time can fuel anxiety sleep issues and school avoidance but it also helps youth share experiences &amp; fight stigma. The goal isn t less screen time healthier habits: digital literacy offline connections &amp; balance. https://t.co/CCMKnzzhuf","1963295989235654732","https://pbs.twimg.com/media/Gz8HRP1WsAEsym9.jpg","","en","","0","0","0","https://x.com/undefined/status/1963295989235654732","1895243344420446211",
"1963174648792662159","Wed Sep 03 17:31:56 +0000 2025","0","@NigeriaStories Na the digital literacy part dey make me laugh. It will end in the teacher copying notes for students and them cramming and writing exams. Digital literacy with no digital gadgets. Even the teachers don't have access to the gadgets.","1963293899796975913","","NigeriaStories","en","","0","0","0","https://x.com/undefined/status/1963293899796975913","1377017114",
"1961637928834339025","Wed Sep 03 17:27:57 +0000 2025","0","@ChristalLa30358 yeah but can digital literacy fix my rug pull losses tho? asking for a friend who really needs it","1963292895613440145","","ChristalLa30358","en","","0","0","0","https://x.com/undefined/status/1963292895613440145","1773771672811716608",
"1963292220406042723","Wed Sep 03 17:25:16 +0000 2025","0","BREAKING NEWS Nigeria 🇳🇬 New school Curriculum: Full List of JSS SS subjects Federal Government has added ~Compulsory digital literacy and basic entrepreneurship for JSS ~ Programming AI Languages for SSS @gihonsteve2 @ #TrendingNow #NewsUpdate https://t.co/6QYnQP5HOA","1963292220406042723","https://pbs.twimg.com/media/Gz8D2jdWcAEQ0bc.jpg","","en","","0","3","0","https://x.com/undefined/status/1963292220406042723","1883395537170276352",
"1963174648792662159","Wed Sep 03 17:23:29 +0000 2025","0","@NigeriaStories Compulsory digital literacy? How many secondary schools in this country has functioning computer and how many students can afford a laptop?","1963291772202725748","","NigeriaStories","en","","0","0","0","https://x.com/undefined/status/1963291772202725748","1865493570183917568",
"1963289485296156807","Wed Sep 03 17:16:45 +0000 2025","1","@ShakoroAbbass @instablog9ja These modules can enhance Nigerian education by: - Journalism: Building communication skills and media literacy. - Programming: Fostering logical thinking and digital problem-solving. - AI &amp; Robotics: Preparing students for tech-driven jobs with hands-on innovation. -","1963290078291333493","","ShakoroAbbass","en","","0","0","0","https://x.com/undefined/status/1963290078291333493","1720665183188922368",
"1963287621964046508","Wed Sep 03 17:06:59 +0000 2025","1","In this #BroadbandHeroes clip ️ we explore why AI literacy must become part of basic digital skills training especially for communities already facing tech access barriers. Learn why knowing when to trust #AI is becoming a core life skill https://t.co/R47XSpLh64","1963287621964046508","","","en","","0","0","0","https://x.com/undefined/status/1963287621964046508","1004827609572601856",
"1963285227381350572","Wed Sep 03 16:57:28 +0000 2025","5","litmus test for hip hop literacy","1963285227381350572","","","en","","0","2","0","https://x.com/undefined/status/1963285227381350572","1242269308111040512",
"1961637928834339025","Wed Sep 03 16:57:15 +0000 2025","0","@ChristalLa30358 yea digital literacy sounds great but have you tried explaining it to someone who just googles stuff?","1963285171995844953","","ChristalLa30358","en","","0","0","0","https://x.com/undefined/status/1963285171995844953","1773772010700582912",
"1963281688496074769","Wed Sep 03 16:43:26 +0000 2025","0","The way forward I believe is to create spaces for basic digital literacy but also critical thinking about AI. To build narratives where creativity intuition and empathy still matter most. And to strengthen community networks so learning doesn t happen alone in front of a","1963281693579821239","","leonortoledo_","en","","0","0","0","https://x.com/undefined/status/1963281693579821239","1951452307171794944",
"1963281674684313982","Wed Sep 03 16:43:21 +0000 2025","0","Compulsory digital literacy for government school weh no get light and computer lab. ️","1963281674684313982","","","en","","0","0","0","https://x.com/undefined/status/1963281674684313982","882152238",
"1963278314828939719","Wed Sep 03 16:30:00 +0000 2025","0","Beyond Digital Literacy: Cultivating Meta AI Skills in Students and Faculty via @facultyfocus https://t.co/PZMKyNlqcr","1963278314828939719","","","en","","0","0","0","https://x.com/undefined/status/1963278314828939719","937063609",
"1963277554808127496","Wed Sep 03 16:26:59 +0000 2025","1","- Compulsory digital literacy and basic entrepreneurship for JSS - Programming AI Languages for SSS The new curriculum for Nigerian Schools which will commence from the next session in September 2025 has been released. https://t.co/g7CDWexGsm","1963277554808127496","https://pbs.twimg.com/media/Gz72hoDWAAg2noQ.jpg","","en","","0","0","0","https://x.com/undefined/status/1963277554808127496","1243618781030744064",
"1963272195536306180","Wed Sep 03 16:13:44 +0000 2025","1","Real reform means equipping kids with critical thinking digital literacy and adaptability. That requires openness - town halls surveys expert panels - not secretive announcements.","1963274220281921942","","ClarionGabe","en","","0","1","0","https://x.com/undefined/status/1963274220281921942","1754176910546890752",
"1963271518445875541","Wed Sep 03 16:03:00 +0000 2025","0","#TechNews from the UN A new ITU report warns that universal internet connectivity by 2030 will require trillions in investment with over 2.6B people offline. Priorities include fibre 4G satellites affordability and digital literacy: https://t.co/2LNyqk3x50","1963271518445875541","","","en","","0","0","0","https://x.com/undefined/status/1963271518445875541","2599923739",
"1963271486539805182","Wed Sep 03 16:02:52 +0000 2025","0","The most fascinating part of this is how it reveals the gap between our perceived digital literacy and our actual vulnerability to manipulation online.","1963271486539805182","","","en","","0","0","0","https://x.com/undefined/status/1963271486539805182","953268162",
"1963270765043671374","Wed Sep 03 16:02:28 +0000 2025","0","@TheKusamarian @AbstractChain The most fascinating part of this is how it reveals the gap between our perceived digital literacy and our actual vulnerability to manipulation online.","1963271384718815411","","TheKusamarian","en","","0","0","0","https://x.com/undefined/status/1963271384718815411","953268162",
